<?xml version="1.0" encoding="UTF-8"?>
<!-- This is the root element of the XML document, named "RecipeBox". This attribute specifies the location of the XML Schema Definition (XSD) file that defines the structure and constraints for the "RecipeBox" document. In this case, it points to the RecipeBoxSchema.xsd file. -->
<RecipeBox xmlns:xsi="http://www.w3.org/2001/XMLSchema-instance" xsi:noNamespaceSchemaLocation="RecipeBoxSchema.xsd">
   <!-- This snippet provides details about a single customer within the "RecipeBox" document. -->
   <!-- This tag indicates the beginning of a "Customer" element. -->
    <Customer> 
        <Name>Tom Hiddleston</Name>
        <Gender>Male</Gender>
        <Birthday>1981-02-09</Birthday>
        <Email>Tom.Hiddleston@example.com</Email>
        <PhoneNo>123-456-7890</PhoneNo>
        <Address>123 Main St, West End, London</Address>
        <!-- This tag indicates the beginning of an "Order" element. A customer can have multiple orders. -->
        <Order>
            <!-- indicates the beginning of a "Content" element within the order. Each "Content" element represents a specific recipe and its quantity in the order. -->
            <Content>
                <!-- specifies the ID of the recipe included in the order. -->
                <RecipeId>R1</RecipeId>
                <!-- specifies the quantity of the recipe included in the order. -->
                <Quantity>2</Quantity>
            </Content>
            <Content>
                <RecipeId>R2</RecipeId>
                <Quantity>1</Quantity>
            </Content>
            <!-- indicates the beginning of a "Delivery" element within the order. It provides details about the delivery of the order. -->
            <Delivery>
                <!-- the delivery date of the order, which is March 9th, 2024. -->
                <DeliveryDate>2024-03-09</DeliveryDate>
                <!-- specifies the delivery service used for the order. -->
                <DeliveryService>Delivery Express</DeliveryService>
                <!-- specifies the status of the delivery, which is "Received". -->
                <Status>Received</Status>
            </Delivery>
        </Order>
        <Order>
            <Content>
                <RecipeId>R1</RecipeId>
                <Quantity>2</Quantity>
            </Content>
            <Content>
                <RecipeId>R2</RecipeId>
                <Quantity>1</Quantity>
            </Content>
            <Delivery>
                <DeliveryDate>2024-03-11</DeliveryDate>
                <DeliveryService>Delivery Co.</DeliveryService>
                <Status>Received</Status>
            </Delivery>
        </Order>
        <Order>
            <Content>
                <RecipeId>R3</RecipeId>
                <Quantity>3</Quantity>
            </Content>
            <Delivery>
                <DeliveryDate>2024-03-15</DeliveryDate>
                <DeliveryService>Delivery Express</DeliveryService>
                <Status>Received</Status>
            </Delivery>
        </Order>
    </Customer>

    <Customer>
        <Name>Rebecca Ferguson</Name>
        <Gender>Female</Gender>
        <Birthday>1983-10-19</Birthday>
        <Email>rf@example.com</Email>
        <PhoneNo>987-654-3210</PhoneNo>
        <Address>456 Oak St, Stockholm</Address>
        <Order>
            <Content>
                <RecipeId>R1</RecipeId>
                <Quantity>3</Quantity>
            </Content>
            <Delivery>
                <DeliveryDate>2024-03-10</DeliveryDate>
                <DeliveryService>Delivery Co.</DeliveryService>
                <Status>Received</Status>
            </Delivery>
        </Order>
        <Order>
            <Content>
                <RecipeId>R8</RecipeId>
                <Quantity>3</Quantity>
            </Content>
            <Delivery>
                <DeliveryDate>2024-03-12</DeliveryDate>
                <DeliveryService>Delivery Co.</DeliveryService>
                <Status>Received</Status>
            </Delivery>
        </Order>
        <Order>
            <Content>
                <RecipeId>R1</RecipeId>
                <Quantity>1</Quantity>
            </Content>
            <Content>
                <RecipeId>R8</RecipeId>
                <Quantity>6</Quantity>
            </Content>
            <Content>
                <RecipeId>R3</RecipeId>
                <Quantity>3</Quantity>
            </Content>
            <Delivery>
                <DeliveryDate>2024-03-18</DeliveryDate>
                <DeliveryService>Delivery Co.</DeliveryService>
                <Status>Ordered</Status>
            </Delivery>
        </Order>
    </Customer>

    <Customer>
        <Name>Sam wills</Name>
        <Gender>Male</Gender>
        <Birthday>1990-01-01</Birthday>
        <Email>samw@example.com</Email>
        <PhoneNo>234-456-7890</PhoneNo>
        <Address>123 Main St, Anytown, USA</Address>
        <Order>
            <Content>
                <RecipeId>R1</RecipeId>
                <Quantity>2</Quantity>
            </Content>
            <Content>
                <RecipeId>R3</RecipeId>
                <Quantity>1</Quantity>
            </Content>
            <Delivery>
                <DeliveryDate>2024-03-09</DeliveryDate>
                <DeliveryService>Delivery Co.</DeliveryService>
                <Status>Received</Status>
            </Delivery>
        </Order>
    </Customer>

    <Customer>
        <Name>Linda Pitt</Name>
        <Gender>Female</Gender>
        <Birthday>1983-05-15</Birthday>
        <Email>linda.pitt@example.com</Email>
        <PhoneNo>988-654-3210</PhoneNo>
        <Address>50 Hackney St, Othertown, USA</Address>
        <Order>
            <Content>
                <RecipeId>R3</RecipeId>
                <Quantity>3</Quantity>
            </Content>
            <Delivery>
                <DeliveryDate>2024-03-10</DeliveryDate>
                <DeliveryService>Delivery Express</DeliveryService>
                <Status>Received</Status>
            </Delivery>
        </Order>
        <Order>
            <Content>
                <RecipeId>R4</RecipeId>
                <Quantity>2</Quantity>
            </Content>
            <Content>
                <RecipeId>R5</RecipeId>
                <Quantity>1</Quantity>
            </Content>
            <Delivery>
                <DeliveryDate>2024-03-11</DeliveryDate>
                <DeliveryService>Delivery Co.</DeliveryService>
                <Status>Received</Status>
            </Delivery>
        </Order>
    </Customer>

    <Customer>
        <Name>Alice Johnson</Name>
        <Gender>Female</Gender>
        <Birthday>1995-08-20</Birthday>
        <Email>alice.johnson@example.com</Email>
        <PhoneNo>111-222-3333</PhoneNo>
        <Address>789 Elm St, Another Town, USA</Address>
        <Order>
            <Content>
                <RecipeId>R4</RecipeId>
                <Quantity>2</Quantity>
            </Content>
            <Content>
                <RecipeId>R5</RecipeId>
                <Quantity>2</Quantity>
            </Content>
            <Delivery>
                <DeliveryDate>2024-03-11</DeliveryDate>
                <DeliveryService>Delivery Co.</DeliveryService>
                <Status>Received</Status>
            </Delivery>
        </Order>
        <Order>
            <Content>
                <RecipeId>R7</RecipeId>
                <Quantity>2</Quantity>
            </Content>
            <Content>
                <RecipeId>R10</RecipeId>
                <Quantity>2</Quantity>
            </Content>
            <Content>
                <RecipeId>R9</RecipeId>
                <Quantity>1</Quantity>
            </Content>
            <Delivery>
                <DeliveryDate>2024-03-17</DeliveryDate>
                <DeliveryService>Delivery Co.</DeliveryService>
                <Status>Received</Status>
            </Delivery>
        </Order>
    </Customer>

    <Customer>
        <Name>Bob Miller</Name>
        <Gender>Male</Gender>
        <Birthday>1980-12-10</Birthday>
        <Email>bob.miller@example.com</Email>
        <PhoneNo>444-555-6666</PhoneNo>
        <Address>321 Maple Ave, Cityville, USA</Address>
        <Order>
            <Content>
                <RecipeId>R6</RecipeId>
                <Quantity>3</Quantity>
            </Content>
            <Delivery>
                <DeliveryDate>2024-03-12</DeliveryDate>
                <DeliveryService>Delivery Express</DeliveryService>
                <Status>Received</Status>
            </Delivery>
        </Order>
    </Customer>

    <Customer>
        <Name>Emily Brown</Name>
        <Gender>Female</Gender>
        <Birthday>1992-04-15</Birthday>
        <Email>emily.brown@example.com</Email>
        <PhoneNo>999-888-7777</PhoneNo>
        <Address>456 Pine St, Smalltown, USA</Address>
        <Order>
            <Content>
                <RecipeId>R7</RecipeId>
                <Quantity>2</Quantity>
            </Content>
            <Content>
                <RecipeId>R8</RecipeId>
                <Quantity>1</Quantity>
            </Content>
            <Delivery>
                <DeliveryDate>2024-03-13</DeliveryDate>
                <DeliveryService>Delivery Express</DeliveryService>
                <Status>Received</Status>
            </Delivery>
        </Order>
    </Customer>

    <Customer>
        <Name>Michael Davis</Name>
        <Gender>Male</Gender>
        <Birthday>1995-11-22</Birthday>
        <Email>michael.davis@example.com</Email>
        <PhoneNo>333-444-5555</PhoneNo>
        <Address>789 Oak St, Countryside, USA</Address>
        <Order>
            <Content>
                <RecipeId>R8</RecipeId>
                <Quantity>3</Quantity>
            </Content>
            <Delivery>
                <DeliveryDate>2024-03-14</DeliveryDate>
                <DeliveryService>Delivery Co.</DeliveryService>
                <Status>Received</Status>